<?xml version="1.0" encoding="UTF-8"?>
<!-- Skill level is now a DWORD, Augmentation effects are now DWORDs -->
<packet id="SM_SYSTEM_MESSAGE" xmlns="http://www.l2emu-unique.net" xmlns:xsi="http://www.w3.org/2001/XMLSchema-instance" xsi:schemaLocation="http://www.l2emu-unique.net ../../../schemata/packet.xsd">
	<word alias="Message" type="ImmutableSystemMessage">
		<scriptAlias id="SYS_MESSAGE_ID" />
	</word>
	<byte alias="Parameter count" id="index_0" />
	<loop id="index_0">
		<byte alias="Parameter" type="Parameter" id="cond_1">
			<scriptAlias id="SYS_MESSAGE_PARAMS" />
		</byte>
		<branch id="cond_1" condition="param.StringValue">
			<string alias="Value" />
		</branch>
		<branch id="cond_1" condition="param.Player">
			<string alias="Player" />
		</branch>
		<branch id="cond_1" condition="param.Item">
			<dword alias="Item" type="Item" />
		</branch>
		<branch id="cond_1" condition="param.Item2">
			<dword alias="Item" type="Item" />
			<!-- NEW -->
			<dword alias="Augmentation effect (1)" type="Augmentation" />
			<dword alias="Augmentation effect (2)" type="Augmentation" optional="true" /> <!-- Equip - OK, Crystallization - malformed -->
		</branch>
		<branch id="cond_1" condition="param.PledgeBase">
			<word alias="Residence" type="PledgeBase" />
		</branch>
		<branch id="cond_1" condition="param.NumberValue">
			<dword alias="Value" />
		</branch>
		<branch id="cond_1" condition="param.Npc">
			<dword alias="NPC" type="Npc" />
		</branch>
		<branch id="cond_1" condition="param.Element"> <!-- Kamael -->
			<byte alias="Element" type="ElementType" />
		</branch>
		<branch id="cond_1" condition="param.Fstring"> <!-- Freya -->
			<dword alias="Value" type="ImmutableNpcString" />
		</branch>
		<branch id="cond_1" condition="param.Sysstring">
			<word alias="Value" type="SysString" />
		</branch>
		<branch id="cond_1" condition="param.Instance"> <!-- Kamael -->
			<word alias="Instance" type="Instance" />
		</branch>
		<branch id="cond_1" condition="param.Quantity"> <!-- C4 -->
			<qword alias="Quantity" />
		</branch>
		<branch id="cond_1" condition="param.Skill">
			<dword alias="Skill" type="Skill">
				<scriptAlias id="__INTERP_CORRECTION_SKILL_ID" />
			</dword>
			<dword alias="Level" type="skill.SkillLevel"> <!-- NEW -->
				<scriptAlias id="__INTERP_CORRECTION_SKILL_LEVEL" />
			</dword>
		</branch>
		<branch id="cond_1" condition="param.Zone">
			<dword alias="Location X" />
			<dword alias="Location Y" />
			<dword alias="Location Z" />
		</branch>
		<branch id="cond_1" condition="param.CharacterClass"> <!-- GoD -->
			<word alias="Class" type="CharacterClass" />
		</branch>
		<branch id="cond_1" condition="param.Damage"> <!-- GoD -->
			<dword alias="Target OID" type="ObjectID" />
			<dword alias="Attacker OID" type="ObjectID" />
			<dword alias="HP change" />
		</branch>
		<branch id="cond_1" condition="param.MutableFstring">
			<dword alias="Value" type="ImmutableNpcString" />
			<string alias="1st token" />
			<string alias="2nd token" />
			<string alias="3rd token" />
			<string alias="4th token" />
			<string alias="5th token" />
		</branch>
		<branch id="cond_1" condition="param.TinyNumberValue"> <!-- Ertheia -->
			<byte alias="Value" />
		</branch>
		<branch id="cond_1" condition="param.SmallNumberValue"> <!-- Ertheia -->
			<word alias="Value" />
		</branch>
	</loop>
</packet>