<?xml version="1.0" encoding="UTF-8"?>
<!-- This file was automatically generated when converting from the legacy definition format. -->
<!-- The packet definition might be a clone of an existing definition in an earlier protocol version. -->
<!-- If so, delete this file. Otherwise, delete this comment (or replace with comments on what has changed). -->
<packet id="623" xmlns="http://www.l2emu-unique.net" xmlns:xsi="http://www.w3.org/2001/XMLSchema-instance" xsi:schemaLocation="http://www.l2emu-unique.net ../../../schemata/packet.xsd">
	<string alias="Pledge Name" />
	<string alias="Leader Name" />
	<dword alias="Pledge Level" />
	<dword alias="1" />
	<dword alias="Sub Unit Count" id="index_0" />
	<loop id="index_0">
		<dword alias="Sub Unit Type" type="PledgeUnit" />
		<string alias="Sub Unit Name" />
	</loop>
</packet>