<?xml version="1.0" encoding="UTF-8"?>
<packet id="SM_MAGIC_SKILL_USE" xmlns="http://www.l2emu-unique.net" xmlns:xsi="http://www.w3.org/2001/XMLSchema-instance" xsi:schemaLocation="http://www.l2emu-unique.net ../../../schemata/packet.xsd">
	<dword alias="Caster OID" type="ObjectID">
		<scriptAlias id="HLE_CASTER_OID" />
	</dword>
	<dword alias="Primary target OID" type="ObjectID">
		<scriptAlias id="HLE_TARGET_OID" />
	</dword>
	<dword alias="Skill" type="Skill">
		<scriptAlias id="__INTERP_CORRECTION_SKILL_ID" />
		<scriptAlias id="HLE_SKILL_ID" />
	</dword>
	<dword alias="Skill level" type="skill.SkillLevel">
		<scriptAlias id="__INTERP_CORRECTION_SKILL_LEVEL" />
		<scriptAlias id="HLE_SKILL_LEVEL" />
	</dword>
	<dword alias="Cast time" type="MillisRemaining">
		<scriptAlias id="HLE_CAST_TIME" />
	</dword>
	<dword alias="Reuse delay" type="MillisRemaining">
		<scriptAlias id="HLE_COOL_TIME" />
	</dword>
</packet>