<?xml version="1.0" encoding="UTF-8"?>
<!-- This file was automatically generated when converting from the legacy definition format. -->
<!-- The packet definition might be a clone of an existing definition in an earlier protocol version. -->
<!-- If so, delete this file. Otherwise, delete this comment (or replace with comments on what has changed). -->

<!-- additional unknown DWORD field (typically 0, unknown when) -->
<packet id="SM_PLEDGE_SHOW_MEMBER_LIST_ALL" xmlns="http://www.l2emu-unique.net" xmlns:xsi="http://www.w3.org/2001/XMLSchema-instance" xsi:schemaLocation="http://www.l2emu-unique.net ../../../schemata/packet.xsd">
	<dword alias="Subunit" type="YesOrNo" />
	<dword alias="Pledge ID" type="Pledge">
		<scriptAlias id="PIC_PLEDGE_ID" />
	</dword>
	<dword alias="Server" type="GameServerName" />
	<dword alias="Unit" type="PledgeUnit" />
	<string alias="Name">
		<scriptAlias id="PIC_PLEDGE_NAME" />
	</string>
	<string alias="Leader name" />
	<dword alias="Crest ID" type="PledgeCrest">
		<scriptAlias id="PIC_PLEDGE_CREST_ID" />
	</dword>
	<dword alias="Level" />
	<dword alias="0" /> <!-- NEW -->
	<dword alias="Castle" type="PledgeBase" />
	<dword alias="Hideout" type="PledgeBase" />
	<dword alias="Fortress" type="PledgeBase" />
	<dword alias="Rank" />
	<dword alias="Reputation" />
	<dword alias="0" />
	<dword alias="0" />
	<dword alias="Alliance ID" type="Alliance">
		<scriptAlias id="AIC_ALLY_ID" />
	</dword>
	<string alias="Alliance name">
		<scriptAlias id="AIC_ALLY_NAME" />
	</string>
	<dword alias="Alliance crest ID" type="AllianceCrest">
		<scriptAlias id="AIC_ALLY_CREST_ID" />
	</dword>
	<dword alias="At war" type="YesOrNo" />
	<dword alias="Territory ward" />
	<dword alias="Member count" id="index_0" />
	<loop id="index_0">
		<string alias="Name" />
		<dword alias="Level" />
		<dword alias="Class" type="CharacterClass" />
		<dword alias="Sex" type="Sex" />
		<dword alias="Race" type="Race" />
		<dword alias="Member OID" type="ObjectID" />
		<dword alias="Apprentice" />
	</loop>
</packet>