<?xml version="1.0" encoding="UTF-8"?>
<packet id="LS_CM_REQUEST_SERVER_LIST" xmlns="http://www.l2emu-unique.net" xmlns:xsi="http://www.w3.org/2001/XMLSchema-instance" xsi:schemaLocation="http://www.l2emu-unique.net ../../../schemata/packet.xsd">
	<dword alias="Account ID" />
	<dword alias="Authorization keypart (1)" />
	<byte alias="List type" type="GameServerListVersion">
		<scriptAlias id="__INVASIVE_AUTO_EXTRACT_GS_LIST_TYPE" />
	</byte>
	
	<bytes alias="Padding[0]">
		<length>6</length>
	</bytes>
	<bytes alias="Checksum">
		<length>4</length>
	</bytes>
	<bytes alias="Padding[0]">
		<length>12</length> <!-- NEW -->
	</bytes>
</packet>