<?xml version="1.0" encoding="UTF-8"?>
<!-- Enchant effect WORDs are now DWORDs -->
<packet id="559" xmlns="http://www.l2emu-unique.net" xmlns:xsi="http://www.w3.org/2001/XMLSchema-instance" xsi:schemaLocation="http://www.l2emu-unique.net ../../../schemata/packet.xsd">
	<dword alias="1" />
	<qword alias="Price (per unit)" />
	<qword alias="Auction ID" />
	<dword alias="Category" type="commission.ItemCategory" />
	<dword alias="0" />
	<dword alias="Item" type="Item" id="is_ticket" />
	<qword alias="Quantity" />
	<word alias="Main item type" type="ItemType2" />
	<qword alias="Used paperdoll slot(s)" type="equip.PaperdollMask" />
	<branch id="is_ticket" condition="GenericItem">
		<word alias="Enchant level" />
		<word alias="Name exists" type="YesOrNo" />
	</branch>
	<branch id="is_ticket" condition="LotteryTicket">
		<dword alias="Selected numbers" type="LottoNumbers" />
	</branch>
	<branch id="is_ticket" condition="MonsterRaceTicket">
		<word alias="Race number" />
		<word alias="Bet" type="MonsterRaceBetMultiplier" />
	</branch>
	<word alias="Attack element" type="ElementType" />
	<word alias="Attack element power" type="ElementPower" />
	<word alias="Fire defense" type="ElementPower" />
	<word alias="Water defense" type="ElementPower" />
	<word alias="Wind defense" type="ElementPower" />
	<word alias="Earth defense" type="ElementPower" />
	<word alias="Holy defense" type="ElementPower" />
	<word alias="Dark defense" type="ElementPower" />
	<dword alias="Enchant effect (1)" type="Augmentation" /> <!-- NEW -->
	<dword alias="Enchant effect (2)" type="Augmentation" /> <!-- NEW -->
	<dword alias="Enchant effect (3)" type="Augmentation" /> <!-- NEW -->
	<branch id="is_ticket" condition="GenericItem">
		<dword alias="Visible item" type="Item" />
	</branch>
	<branch id="is_ticket" condition="LotteryTicket">
		<dword alias="Selected numbers" type="LottoNumbers" />
	</branch>
	<branch id="is_ticket" condition="MonsterRaceTicket"> <!-- untested -->
		<word alias="Race number" />
		<word alias="Bet" type="MonsterRaceBetMultiplier" />
	</branch>
</packet>