<?xml version="1.0" encoding="UTF-8"?>
<!-- This file was automatically generated when converting from the legacy definition format. -->
<!-- The packet definition might be a clone of an existing definition in an earlier protocol version. -->
<!-- If so, delete this file. Otherwise, delete this comment (or replace with comments on what has changed). -->
<packet id="346" xmlns="http://www.l2emu-unique.net" xmlns:xsi="http://www.w3.org/2001/XMLSchema-instance" xsi:schemaLocation="http://www.l2emu-unique.net ../../../schemata/packet.xsd">
	<dword alias="Pledge skill count" id="index_0" />
	<dword alias="Unit skill count" id="index_1" />
	<loop id="index_0">
		<dword alias="Skill" type="Skill">
			<scriptAlias id="__INTERP_CORRECTION_SKILL_ID" />
		</dword>
		<dword alias="Level" type="skill.SkillLevel">
			<scriptAlias id="__INTERP_CORRECTION_SKILL_LEVEL" />
		</dword>
	</loop>
	<loop id="index_1">
		<dword alias="Unit" type="PledgeUnit" />
		<dword alias="Skill" type="Skill">
			<scriptAlias id="__INTERP_CORRECTION_SKILL_ID" />
		</dword>
		<dword alias="Level" type="skill.SkillLevel">
			<scriptAlias id="__INTERP_CORRECTION_SKILL_LEVEL" />
		</dword>
	</loop>
</packet>